{
  "type": "command",
  "id": "01JZQK8N4T00000000000000K1",
  "session": "sess_01JZQK8N4T",
  "seq": 10,
  "ts": { "mono_ns": 9920000000, "utc": "2026-07-29T18:00:07.500Z" },
  "trace_id": "trc_greet",
  "span_id": "spn_say_1",
  "payload": {
    "capability": "spk0",
    "action": "say",
    "params": { "text": "Hello." },
    "ttl_ms": 5000,
    "expects_result": true
  }
}
