{
  "type": "event",
  "id": "01JZQK8N4T00000000000000J1",
  "session": "sess_01JZQK8N4T",
  "seq": 9,
  "ts": { "mono_ns": 9919000000, "utc": "2026-07-29T18:00:06.500Z" },
  "payload": {
    "capability": "sys",
    "event": "state",
    "data": { "state": "safe_hold", "cause": "brain heartbeat lease miss" },
    "droppable": false
  }
}
