{
  "type": "command_result",
  "id": "01JZQK8N4T00000000000000N1",
  "session": "sess_01JZQK8N4T",
  "seq": 13,
  "ts": { "mono_ns": 9923000000, "utc": "2026-07-29T18:00:09.900Z" },
  "trace_id": "trc_greet",
  "span_id": "spn_say_1",
  "payload": {
    "status": "succeeded",
    "progress": 1.0,
    "data": {},
    "error": null
  }
}
